<?xml version="1.0" encoding="UTF-8"?>
<beans xmlns="http://indi.ray.miniSpring"
       xmlns:xsi="http://www.w3.org/2001/XMLSchema-instance"
       xsi:schemaLocation="http://indi.ray.miniSpring /Users/raywang/IdeaProjects/miniSpring/src/test/resources/schema/mySpring.xsd"
       default-autowire="byName">
    <bean id="pojo1" class="com.ray.miniSpring.core.functionTest.xml.basic.PoJoTestBean"/>
    <bean class="com.ray.miniSpring.core.functionTest.xml.basic.PoJoTestBean"/>
    <bean id="pojo2" class="com.ray.miniSpring.core.functionTest.xml.basic.PoJoTestBean"/>
    <bean id="constructorTestBean" class="com.ray.miniSpring.core.functionTest.xml.basic.ConstructorTestBean">
        <constructor-arg type="java.lang.Object" index="0">
            <ref>pojo1</ref>
        </constructor-arg>
        <constructor-arg type="com.ray.miniSpring.core.functionTest.xml.basic.PoJoTestBean" index="1">
            <ref>pojo2</ref>
        </constructor-arg>
    </bean>
</beans>
